{
  "candidate_id": "VII-C010",
  "condition_grade": "Candidate theorem/schema at the declared scope; necessity/sufficiency only where explicitly proved later.",
  "convergence_groups": [
    "CG09"
  ],
  "countermodels": [
    "CM-01",
    "CM-26"
  ],
  "decision_status": "READY_FOR_LATER_PROOF_OR_SCOPE_DECISION",
  "detector": {
    "falsifier": "A well-typed model satisfying the hypotheses but violating the proposed conclusion for Source-independence gate.",
    "null": "A matched case with the principal witness removed while all unrelated fields are held fixed.",
    "signal": "A source-typed witness satisfying the Source-independence gate record and its declared audit."
  },
  "escape_routes": [
    "Narrow or change the declared carrier/interface family.",
    "Add an explicit source, seed, bridge, budget, or drive witness omitted by the no-go hypotheses."
  ],
  "falsifier": "A valid declared-scope countermodel to Independence-sensitive join claims require a source/ancestry witness separate from behavioral nonfactorization; native and bridged records retain their source types.",
  "formalization_targets": [
    "FT05"
  ],
  "hypotheses": [
    "All records are well typed and source-located.",
    "No undeclared operation, source, or observer resource is used.",
    "Inherited results are transported only through accepted bridge/reuse records."
  ],
  "informal_law": "Independence-sensitive join claims require a source/ancestry witness separate from behavioral nonfactorization; native and bridged records retain their source types.",
  "kind": "DEFINITION_AND_NO_GO_SCHEMA",
  "layer_instantiations": [
    "finite formal theory domains",
    "cognitive/social access policies",
    "instrument-limited scientific applications"
  ],
  "name": "Source-independence gate",
  "nonclaims": [
    "Source independence is not sufficient for strict novelty or causal independence.",
    "This Step-3 dossier is not a proof of the candidate.",
    "Finite reference-world success does not universalize the statement."
  ],
  "null_models": [
    "TTW-S11"
  ],
  "positive_model": [
    "TTW-S05"
  ],
  "priority": "P0",
  "proof_obligations": [
    "Define ancestry equivalence and honest bridging.",
    "Prove same-lineage re-expression fails independence credit.",
    "Separate source independence from causal independence."
  ],
  "proof_status": "SPECIFICATION_READY_NOT_PROVED",
  "proposed_conclusion": "Independence-sensitive join claims require a source/ancestry witness separate from behavioral nonfactorization; native and bridged records retain their source types.",
  "recommended_chapter": "Ch06",
  "setup": [
    "Fix the inherited SBT theory package(s), carrier, interfaces, quotient/readout, and audit scope.",
    "Declare all source, transition, budget, observer, and temporal records used by the candidate.",
    "Restrict the conclusion to the stated finite or explicitly quantified carrier until a stronger proof is supplied."
  ],
  "source_trace": {
    "boundary_claim_ids": [
      "P026-C0207",
      "P026-C0115",
      "P026-C0044",
      "P026-C0033",
      "P026-C0030",
      "P026-C0264",
      "P026-C0154",
      "P026-C0043",
      "P026-C0194",
      "P026-C0230",
      "P026-C0101",
      "P030-C0110",
      "P013-C0016",
      "P026-C0263",
      "P026-C0256",
      "P026-C0165",
      "P026-C0161",
      "P026-C0035",
      "P026-C0060",
      "P026-C0052",
      "P030-C0117",
      "P049-C0017",
      "P049-C0009",
      "P026-C0255",
      "P026-C0249",
      "P026-C0025",
      "P030-C0082",
      "P030-C0108"
    ],
    "bridge_ids": [
      "BR-CITE-0170",
      "BR-CITE-0171",
      "BR-CITE-0173",
      "BR-CITE-0174",
      "BR-CITE-0179",
      "BR-LAW-0021",
      "BR-LAW-0026",
      "BR-LAW-0033",
      "BR-CITE-0123",
      "BR-LAW-0014",
      "BR-LAW-0015",
      "BR-LAW-0016",
      "BR-LAW-0017",
      "BR-LAW-0018",
      "BR-LAW-0019",
      "BR-LAW-0020",
      "BR-LAW-0022",
      "BR-LAW-0024",
      "BR-LAW-0028",
      "BR-LAW-0030",
      "BR-LAW-0032",
      "BR-CITE-0014",
      "BR-CITE-0074",
      "BR-CITE-0093",
      "BR-LAW-0031",
      "BR-CITE-0125",
      "BR-CITE-0016",
      "BR-CITE-0124",
      "BR-CITE-0126",
      "BR-CITE-0127",
      "BR-CITE-0128",
      "BR-CITE-0129",
      "BR-CITE-0130",
      "BR-CITE-0131",
      "BR-CITE-0132"
    ],
    "law_or_no_go_ids": [
      "E1",
      "E10",
      "E13",
      "E14",
      "E16",
      "F10",
      "F11",
      "F12",
      "F13a",
      "F17",
      "F19",
      "F2",
      "F20",
      "F21",
      "F25",
      "F3",
      "F31",
      "F6",
      "F7",
      "F8",
      "F9",
      "E4",
      "E9",
      "E15",
      "E12",
      "E2"
    ],
    "open_problem_ids": [
      "P030-C0059",
      "P030-C0056",
      "P030-C0120",
      "P013-C0037",
      "P026-C0285",
      "P026-C0197",
      "P026-C0252",
      "P013-C0004",
      "P049-C0020",
      "P026-C0107",
      "P013-C0033",
      "P044-C0011",
      "P026-C0284",
      "P026-C0209",
      "P026-C0277",
      "P026-C0131",
      "P026-C0219"
    ],
    "resolved_source_locations": [
      {
        "candidate_id": "VII-C010",
        "claim_grade": "NEGATIVE_RESULT_THEOREM",
        "claim_id": "P030-C0014",
        "claim_type": "proposition",
        "conclusion": "rho is carried only if sigma∈\\ committed_state, audited_cell_records\\ , g=i=true. In particular, fallback, independent-witness, simulation-trace, ablation-record, unknown, and contradictory sources cannot be made carried by setting g=i=true",
        "formalization_status": "NO_MATCH",
        "hypotheses": [
          {
            "extraction": "EXPLICIT_CONCLUSION_BOUNDARY",
            "text": "Let rho have fine source tag sigma , carrier-generation flag g , scope flag i , carrier-coordinate evidence, and a declared trajectory whose steps lie in the carrier kernel"
          }
        ],
        "nonclaims": [
          "P030-C0012",
          "P030-C0020",
          "P030-C0024",
          "P030-C0028",
          "P030-C0033",
          "P030-C0038",
          "P030-C0044",
          "P030-C0055",
          "P030-C0058",
          "P030-C0063",
          "P030-C0065",
          "P030-C0074",
          "P030-C0082",
          "P030-C0090",
          "P030-C0108",
          "P030-C0109",
          "P030-C0110",
          "P030-C0111",
          "P030-C0112",
          "P030-C0114",
          "P030-C0117",
          "P030-C0121",
          "P030-C0122",
          "P030-C0123",
          "P030-C0124",
          "P030-C0126"
        ],
        "normalized_claim": "Carried-source exclusion: Let rho have fine source tag sigma , carrier-generation flag g , scope flag i , carrier-coordinate evidence, and a declared trajectory whose steps lie in the carrier kernel. Then rho is carried only if sigma∈\\ committed_state, audited_cell_records\\ , g=i=true. In particular, fallback, independent-witness, simulation-trace, ablation-record, unknown, and contradictory sources cannot be made carried by setting g=i=true .",
        "proof_status": "PROOF_PRESENT_IN_SOURCE",
        "source_location": "source/papers/Tsiokos_2026_Six_Birds_Foundations_V_Endogenous_Closure_A_Catalog_of_Structural_Laws_for_Living_Cognitive_and_Social_Systems.tex:L639-L651; derived/expanded/Tsiokos_2026_Six_Birds_Foundations_V_Endogenous_Closure_A_Catalog_of_Structural_Laws_for_Living_Cognitive_and_Social_Systems.tex:L639-L651",
        "source_paper": "P030",
        "source_title": "Foundations V: Endogenous Closure",
        "trace_role": "SUPPORT"
      },
      {
        "candidate_id": "VII-C010",
        "claim_grade": "THEOREM_GRADE",
        "claim_id": "P030-C0102",
        "claim_type": "proposition",
        "conclusion": "AdaptabilityRejected( )",
        "formalization_status": "MATCHED_IMPORTED_LAW_DECLARATION",
        "hypotheses": [
          {
            "extraction": "EXPLICIT_CONCLUSION_BOUNDARY",
            "text": "Suppose a repair-ledger holonomy candidate matches , its declared perturbation bound and perturbation-trial inventory are carried and complete, and an inventory-member in-bound trial supplies bounded-perturbation failure. Suppose also that a carried status record for has tag adaptability_rejected and that raw support-confound, artifact, flat, flattenable, currentizable, dissipative, and coherent-adaptability evidence are each explicitly absent"
          }
        ],
        "nonclaims": [
          "P030-C0012",
          "P030-C0020",
          "P030-C0024",
          "P030-C0028",
          "P030-C0033",
          "P030-C0038",
          "P030-C0044",
          "P030-C0055",
          "P030-C0058",
          "P030-C0063",
          "P030-C0065",
          "P030-C0074",
          "P030-C0082",
          "P030-C0090",
          "P030-C0108",
          "P030-C0109",
          "P030-C0110",
          "P030-C0111",
          "P030-C0112",
          "P030-C0114",
          "P030-C0117",
          "P030-C0121",
          "P030-C0122",
          "P030-C0123",
          "P030-C0124",
          "P030-C0126"
        ],
        "normalized_claim": "Bounded perturbation failure yields evidence-backed rejection (E16_BoundedPerturbationFailureRejected): Suppose a repair-ledger holonomy candidate matches , its declared perturbation bound and perturbation-trial inventory are carried and complete, and an inventory-member in-bound trial supplies bounded-perturbation failure. Suppose also that a carried status record for has tag adaptability_rejected and that raw support-confound, artifact, flat, flattenable, currentizable, dissipative, and coherent-adaptability evidence are each explicitly absent. Then AdaptabilityRejected( ).",
        "proof_status": "PROOF_PRESENT_IN_SOURCE",